event_ticker,series_ticker,title,sub_title,status,event_date,away_team,home_team
KXNBAGAME-25NOV22NYKORL,KXNBAGAME,New York K vs Orlando,NYK at ORL (Nov 22),,2025-11-22,NYK,ORL
KXNBAGAME-25NOV22LACCHA,KXNBAGAME,Los Angeles C vs Charlotte,LAC at CHA (Nov 22),,2025-11-22,LAC,CHA
KXNBAGAME-25NOV21PORGSW,KXNBAGAME,Portland vs Golden State,POR at GSW (Nov 21),,2025-11-21,POR,GSW
KXNBAGAME-25NOV21OKCUTA,KXNBAGAME,Oklahoma City vs Utah,OKC at UTA (Nov 21),,2025-11-21,OKC,UTA
KXNBAGAME-25NOV21DENHOU,KXNBAGAME,Denver vs Houston,DEN at HOU (Nov 21),,2025-11-21,DEN,HOU
KXNBAGAME-25NOV21MINPHX,KXNBAGAME,Minnesota vs Phoenix,MIN at PHX (Nov 21),,2025-11-21,MIN,PHX
KXNBAGAME-25NOV21NOPDAL,KXNBAGAME,New Orleans vs Dallas,NOP at DAL (Nov 21),,2025-11-21,NOP,DAL
KXNBAGAME-25NOV21MIACHI,KXNBAGAME,Miami vs Chicago,MIA at CHI (Nov 21),,2025-11-21,MIA,CHI
KXNBAGAME-25NOV21WASTOR,KXNBAGAME,Washington vs Toronto,WAS at TOR (Nov 21),,2025-11-21,WAS,TOR
KXNBAGAME-25NOV21BKNBOS,KXNBAGAME,Brooklyn vs Boston,BKN at BOS (Nov 21),,2025-11-21,BKN,BOS
KXNBAGAME-25NOV21INDCLE,KXNBAGAME,Indiana vs Cleveland,IND at CLE (Nov 21),,2025-11-21,IND,CLE
KXNBAGAME-25NOV20SACMEM,KXNBAGAME,Sacramento vs Memphis,SAC at MEM (Nov 20),,2025-11-20,SAC,MEM
KXNBAGAME-25NOV20PHIMIL,KXNBAGAME,Philadelphia vs Milwaukee,PHI at MIL (Nov 20),,2025-11-20,PHI,MIL
KXNBAGAME-25NOV20ATLSAS,KXNBAGAME,Atlanta vs San Antonio,ATL at SAS (Nov 20),,2025-11-20,ATL,SAS
KXNBAGAME-25NOV20LACORL,KXNBAGAME,Los Angeles C vs Orlando,LAC at ORL (Nov 20),,2025-11-20,LAC,ORL
KXNBAGAME-25NOV19CHIPOR,KXNBAGAME,Chicago vs Portland,CHI at POR (Nov 19),,2025-11-19,CHI,POR
KXNBAGAME-25NOV19NYKDAL,KXNBAGAME,New York K vs Dallas,NYK at DAL (Nov 19),,2025-11-19,NYK,DAL
KXNBAGAME-25NOV19WASMIN,KXNBAGAME,Washington vs Minnesota,WAS at MIN (Nov 19),,2025-11-19,WAS,MIN
KXNBAGAME-25NOV19SACOKC,KXNBAGAME,Sacramento vs Oklahoma City,SAC at OKC (Nov 19),,2025-11-19,SAC,OKC
KXNBAGAME-25NOV19DENNOP,KXNBAGAME,Denver vs New Orleans,DEN at NOP (Nov 19),,2025-11-19,DEN,NOP
KXNBAGAME-25NOV19GSWMIA,KXNBAGAME,Golden State vs Miami,GSW at MIA (Nov 19),,2025-11-19,GSW,MIA
KXNBAGAME-25NOV19TORPHI,KXNBAGAME,Toronto vs Philadelphia,TOR at PHI (Nov 19),,2025-11-19,TOR,PHI
KXNBAGAME-25NOV19HOUCLE,KXNBAGAME,Houston vs Cleveland,HOU at CLE (Nov 19),,2025-11-19,HOU,CLE
KXNBAGAME-25NOV19CHAIND,KXNBAGAME,Charlotte vs Indiana,CHA at IND (Nov 19),,2025-11-19,CHA,IND
KXNBAGAME-25NOV18PHXPOR,KXNBAGAME,Phoenix vs Portland,PHX at POR (Nov 18),,2025-11-18,PHX,POR
KXNBAGAME-25NOV18UTALAL,KXNBAGAME,Utah vs Los Angeles L,UTA at LAL (Nov 18),,2025-11-18,UTA,LAL
KXNBAGAME-25NOV18MEMSAS,KXNBAGAME,Memphis vs San Antonio,MEM at SAS (Nov 18),,2025-11-18,MEM,SAS
KXNBAGAME-25NOV18DETATL,KXNBAGAME,Detroit vs Atlanta,DET at ATL (Nov 18),,2025-11-18,DET,ATL
KXNBAGAME-25NOV18BOSBKN,KXNBAGAME,Boston vs Brooklyn,BOS at BKN (Nov 18),,2025-11-18,BOS,BKN
KXNBAGAME-25NOV18GSWORL,KXNBAGAME,Golden State vs Orlando,GSW at ORL (Nov 18),,2025-11-18,GSW,ORL
KXNBAGAME-25NOV17CHIDEN,KXNBAGAME,Chicago vs Denver,CHI at DEN (Nov 17),,2025-11-17,CHI,DEN
KXNBAGAME-25NOV17OKCNOP,KXNBAGAME,Oklahoma City vs New Orleans,OKC at NOP (Nov 17),,2025-11-17,OKC,NOP
KXNBAGAME-25NOV17DALMIN,KXNBAGAME,Dallas vs Minnesota,DAL at MIN (Nov 17),,2025-11-17,DAL,MIN
KXNBAGAME-25NOV17NYKMIA,KXNBAGAME,New York K vs Miami,NYK at MIA (Nov 17),,2025-11-17,NYK,MIA
KXNBAGAME-25NOV17CHATOR,KXNBAGAME,Charlotte vs Toronto,CHA at TOR (Nov 17),,2025-11-17,CHA,TOR
KXNBAGAME-25NOV17MILCLE,KXNBAGAME,Milwaukee vs Cleveland,MIL at CLE (Nov 17),,2025-11-17,MIL,CLE
KXNBAGAME-25NOV17LACPHI,KXNBAGAME,Los Angeles C vs Philadelphia,LAC at PHI (Nov 17),,2025-11-17,LAC,PHI
KXNBAGAME-25NOV17INDDET,KXNBAGAME,Indiana vs Detroit,IND at DET (Nov 17),,2025-11-17,IND,DET
KXNBAGAME-25NOV16CHIUTA,KXNBAGAME,Chicago vs Utah,CHI at UTA (Nov 16),,2025-11-16,CHI,UTA
KXNBAGAME-25NOV16ATLPHX,KXNBAGAME,Atlanta vs Phoenix,ATL at PHX (Nov 16),,2025-11-16,ATL,PHX
KXNBAGAME-25NOV16PORDAL,KXNBAGAME,Portland vs Dallas,POR at DAL (Nov 16),,2025-11-16,POR,DAL
KXNBAGAME-25NOV16ORLHOU,KXNBAGAME,Orlando vs Houston,ORL at HOU (Nov 16),,2025-11-16,ORL,HOU
KXNBAGAME-25NOV16GSWNOP,KXNBAGAME,Golden State vs New Orleans,GSW at NOP (Nov 16),,2025-11-16,GSW,NOP
KXNBAGAME-25NOV16BKNWAS,KXNBAGAME,Brooklyn vs Washington,BKN at WAS (Nov 16),,2025-11-16,BKN,WAS
KXNBAGAME-25NOV16SACSAS,KXNBAGAME,Sacramento vs San Antonio,SAC at SAS (Nov 16),,2025-11-16,SAC,SAS
KXNBAGAME-25NOV16LACBOS,KXNBAGAME,Los Angeles C vs Boston,LAC at BOS (Nov 16),,2025-11-16,LAC,BOS
KXNBAGAME-25NOV15LALMIL,KXNBAGAME,Los Angeles L vs Milwaukee,LAL at MIL (Nov 15),,2025-11-15,LAL,MIL
KXNBAGAME-25NOV15DENMIN,KXNBAGAME,Denver vs Minnesota,DEN at MIN (Nov 15),,2025-11-15,DEN,MIN
KXNBAGAME-25NOV15TORIND,KXNBAGAME,Toronto vs Indiana,TOR at IND (Nov 15),,2025-11-15,TOR,IND
KXNBAGAME-25NOV15OKCCHA,KXNBAGAME,Oklahoma City vs Charlotte,OKC at CHA (Nov 15),,2025-11-15,OKC,CHA
KXNBAGAME-25NOV15MEMCLE,KXNBAGAME,Memphis vs Cleveland,MEM at CLE (Nov 15),,2025-11-15,MEM,CLE
KXNBAGAME-25NOV14GSWSAS,KXNBAGAME,Golden State vs San Antonio,GSW at SAS (Nov 14),,2025-11-14,GSW,SAS
KXNBAGAME-25NOV14LACDAL,KXNBAGAME,Los Angeles C vs Dallas,LAC at DAL (Nov 14),,2025-11-14,LAC,DAL
KXNBAGAME-25NOV14SACMIN,KXNBAGAME,Sacramento vs Minnesota,SAC at MIN (Nov 14),,2025-11-14,SAC,MIN
KXNBAGAME-25NOV14PORHOU,KXNBAGAME,Portland vs Houston,POR at HOU (Nov 14),,2025-11-14,POR,HOU
KXNBAGAME-25NOV14LALNOP,KXNBAGAME,Los Angeles L vs New Orleans,LAL at NOP (Nov 14),,2025-11-14,LAL,NOP
KXNBAGAME-25NOV14CHAMIL,KXNBAGAME,Charlotte vs Milwaukee,CHA at MIL (Nov 14),,2025-11-14,CHA,MIL
KXNBAGAME-25NOV14PHIDET,KXNBAGAME,Philadelphia vs Detroit,PHI at DET (Nov 14),,2025-11-14,PHI,DET
KXNBAGAME-25NOV14MIANYK,KXNBAGAME,Miami vs New York K,MIA at NYK (Nov 14),,2025-11-14,MIA,NYK
KXNBAGAME-25NOV14BKNORL,KXNBAGAME,Brooklyn vs Orlando,BKN at ORL (Nov 14),,2025-11-14,BKN,ORL
KXNBAGAME-25NOV13INDPHX,KXNBAGAME,Indiana vs Phoenix,IND at PHX (Nov 13),,2025-11-13,IND,PHX
KXNBAGAME-25NOV13ATLUTA,KXNBAGAME,Atlanta vs Utah,ATL at UTA (Nov 13),,2025-11-13,ATL,UTA
KXNBAGAME-25NOV13TORCLE,KXNBAGAME,Toronto vs Cleveland,TOR at CLE (Nov 13),,2025-11-13,TOR,CLE
KXNBAGAME-25NOV12DENLAC,KXNBAGAME,Denver vs Los Angeles C,DEN at LAC (Nov 12),,2025-11-12,DEN,LAC
KXNBAGAME-25NOV12ATLSAC,KXNBAGAME,Atlanta vs Sacramento,ATL at SAC (Nov 12),,2025-11-12,ATL,SAC
KXNBAGAME-25NOV12LALOKC,KXNBAGAME,Los Angeles L vs Oklahoma City,LAL at OKC (Nov 12),,2025-11-12,LAL,OKC
KXNBAGAME-25NOV12PHXDAL,KXNBAGAME,Phoenix vs Dallas,PHX at DAL (Nov 12),,2025-11-12,PHX,DAL
KXNBAGAME-25NOV12WASHOU,KXNBAGAME,Washington vs Houston,WAS at HOU (Nov 12),,2025-11-12,WAS,HOU
KXNBAGAME-25NOV12PORNOP,KXNBAGAME,Portland vs New Orleans,POR at NOP (Nov 12),,2025-11-12,POR,NOP
KXNBAGAME-25NOV12GSWSAS,KXNBAGAME,Golden State vs San Antonio,GSW at SAS (Nov 12),,2025-11-12,GSW,SAS
KXNBAGAME-25NOV12MEMBOS,KXNBAGAME,Memphis vs Boston,MEM at BOS (Nov 12),,2025-11-12,MEM,BOS
KXNBAGAME-25NOV12CLEMIA,KXNBAGAME,Cleveland vs Miami,CLE at MIA (Nov 12),,2025-11-12,CLE,MIA
KXNBAGAME-25NOV12ORLNYK,KXNBAGAME,Orlando vs New York K,ORL at NYK (Nov 12),,2025-11-12,ORL,NYK
KXNBAGAME-25NOV12MILCHA,KXNBAGAME,Milwaukee vs Charlotte,MIL at CHA (Nov 12),,2025-11-12,MIL,CHA
KXNBAGAME-25NOV12CHIDET,KXNBAGAME,Chicago vs Detroit,CHI at DET (Nov 12),,2025-11-12,CHI,DET
KXNBAGAME-25NOV11DENSAC,KXNBAGAME,Denver vs Sacramento,DEN at SAC (Nov 11),,2025-11-11,DEN,SAC
KXNBAGAME-25NOV11INDUTA,KXNBAGAME,Indiana vs Utah,IND at UTA (Nov 11),,2025-11-11,IND,UTA
KXNBAGAME-25NOV11GSWOKC,KXNBAGAME,Golden State vs Oklahoma City,GSW at OKC (Nov 11),,2025-11-11,GSW,OKC
KXNBAGAME-25NOV11BOSPHI,KXNBAGAME,Boston vs Philadelphia,BOS at PHI (Nov 11),,2025-11-11,BOS,PHI
KXNBAGAME-25NOV11TORBKN,KXNBAGAME,Toronto vs Brooklyn,TOR at BKN (Nov 11),,2025-11-11,TOR,BKN
KXNBAGAME-25NOV11MEMNYK,KXNBAGAME,Memphis vs New York K,MEM at NYK (Nov 11),,2025-11-11,MEM,NYK
KXNBAGAME-25NOV10ATLLAC,KXNBAGAME,Atlanta vs Los Angeles C,ATL at LAC (Nov 10),,2025-11-10,ATL,LAC
KXNBAGAME-25NOV10NOPPHX,KXNBAGAME,New Orleans vs Phoenix,NOP at PHX (Nov 10),,2025-11-10,NOP,PHX
KXNBAGAME-25NOV10MINUTA,KXNBAGAME,Minnesota vs Utah,MIN at UTA (Nov 10),,2025-11-10,MIN,UTA
KXNBAGAME-25NOV10MILDAL,KXNBAGAME,Milwaukee vs Dallas,MIL at DAL (Nov 10),,2025-11-10,MIL,DAL
KXNBAGAME-25NOV10SASCHI,KXNBAGAME,San Antonio vs Chicago,SAS at CHI (Nov 10),,2025-11-10,SAS,CHI
KXNBAGAME-25NOV10CLEMIA,KXNBAGAME,Cleveland vs Miami,CLE at MIA (Nov 10),,2025-11-10,CLE,MIA
KXNBAGAME-25NOV10WASDET,KXNBAGAME,Washington vs Detroit,WAS at DET (Nov 10),,2025-11-10,WAS,DET
KXNBAGAME-25NOV10PORORL,KXNBAGAME,Portland vs Orlando,POR at ORL (Nov 10),,2025-11-10,POR,ORL
KXNBAGAME-25NOV10LALCHA,KXNBAGAME,Los Angeles L vs Charlotte,LAL at CHA (Nov 10),,2025-11-10,LAL,CHA
KXNBAGAME-25NOV09MINSAC,KXNBAGAME,Minnesota vs Sacramento,MIN at SAC (Nov 9),,2025-11-09,MIN,SAC
KXNBAGAME-25NOV09INDGSW,KXNBAGAME,Indiana vs Golden State,IND at GSW (Nov 9),,2025-11-09,IND,GSW
KXNBAGAME-25NOV09DETPHI,KXNBAGAME,Detroit vs Philadelphia,DET at PHI (Nov 9),,2025-11-09,DET,PHI
KXNBAGAME-25NOV09OKCMEM,KXNBAGAME,Oklahoma City vs Memphis,OKC at MEM (Nov 9),,2025-11-09,OKC,MEM
KXNBAGAME-25NOV09BOSORL,KXNBAGAME,Boston vs Orlando,BOS at ORL (Nov 9),,2025-11-09,BOS,ORL
KXNBAGAME-25NOV09BKNNYK,KXNBAGAME,Brooklyn vs New York K,BKN at NYK (Nov 9),,2025-11-09,BKN,NYK
KXNBAGAME-25NOV09HOUMIL,KXNBAGAME,Houston vs Milwaukee,HOU at MIL (Nov 9),,2025-11-09,HOU,MIL
KXNBAGAME-25NOV08PHXLAC,KXNBAGAME,Phoenix vs Los Angeles C,PHX at LAC (Nov 8),,2025-11-08,PHX,LAC
KXNBAGAME-25NOV08INDDEN,KXNBAGAME,Indiana vs Denver,IND at DEN (Nov 8),,2025-11-08,IND,DEN
KXNBAGAME-25NOV08PORMIA,KXNBAGAME,Portland vs Miami,POR at MIA (Nov 8),,2025-11-08,POR,MIA
KXNBAGAME-25NOV08NOPSAS,KXNBAGAME,New Orleans vs San Antonio,NOP at SAS (Nov 8),,2025-11-08,NOP,SAS
KXNBAGAME-25NOV08LALATL,KXNBAGAME,Los Angeles L vs Atlanta,LAL at ATL (Nov 8),,2025-11-08,LAL,ATL
KXNBAGAME-25NOV08CHICLE,KXNBAGAME,Chicago vs Cleveland,CHI at CLE (Nov 8),,2025-11-08,CHI,CLE
KXNBAGAME-25NOV08TORPHI,KXNBAGAME,Toronto vs Philadelphia,TOR at PHI (Nov 8),,2025-11-08,TOR,PHI
KXNBAGAME-25NOV08DALWAS,KXNBAGAME,Dallas vs Washington,DAL at WAS (Nov 8),,2025-11-08,DAL,WAS
KXNBAGAME-25NOV07OKCSAC,KXNBAGAME,Oklahoma City vs Sacramento,OKC at SAC (Nov 7),,2025-11-07,OKC,SAC
KXNBAGAME-25NOV07GSWDEN,KXNBAGAME,Golden State vs Denver,GSW at DEN (Nov 7),,2025-11-07,GSW,DEN
KXNBAGAME-25NOV07UTAMIN,KXNBAGAME,Utah vs Minnesota,UTA at MIN (Nov 7),,2025-11-07,UTA,MIN
KXNBAGAME-25NOV07DALMEM,KXNBAGAME,Dallas vs Memphis,DAL at MEM (Nov 7),,2025-11-07,DAL,MEM
KXNBAGAME-25NOV07CHIMIL,KXNBAGAME,Chicago vs Milwaukee,CHI at MIL (Nov 7),,2025-11-07,CHI,MIL
KXNBAGAME-25NOV07CHAMIA,KXNBAGAME,Charlotte vs Miami,CHA at MIA (Nov 7),,2025-11-07,CHA,MIA
KXNBAGAME-25NOV07TORATL,KXNBAGAME,Toronto vs Atlanta,TOR at ATL (Nov 7),,2025-11-07,TOR,ATL
KXNBAGAME-25NOV07HOUSAS,KXNBAGAME,Houston vs San Antonio,HOU at SAS (Nov 7),,2025-11-07,HOU,SAS
KXNBAGAME-25NOV07DETBKN,KXNBAGAME,Detroit vs Brooklyn,DET at BKN (Nov 7),,2025-11-07,DET,BKN
KXNBAGAME-25NOV07CLEWAS,KXNBAGAME,Cleveland vs Washington,CLE at WAS (Nov 7),,2025-11-07,CLE,WAS
KXNBAGAME-25NOV07BOSORL,KXNBAGAME,Boston vs Orlando,BOS at ORL (Nov 7),,2025-11-07,BOS,ORL
KXNBAGAME-25NOV06LACPHX,KXNBAGAME,LA vs Phoenix,LAC at PHX (Nov 6),,2025-11-06,LAC,PHX
KXNBAGAME-25NOV05SASLAL,KXNBAGAME,San Antonio vs Los Angeles L,SAS at LAL (Nov 5),,2025-11-05,SAS,LAL
KXNBAGAME-25NOV05OKCPOR,KXNBAGAME,Oklahoma City vs Portland,OKC at POR (Nov 5),,2025-11-05,OKC,POR
KXNBAGAME-25NOV05GSWSAC,KXNBAGAME,Golden State vs Sacramento,GSW at SAC (Nov 5),,2025-11-05,GSW,SAC
KXNBAGAME-25NOV05MIADEN,KXNBAGAME,Miami vs Denver,MIA at DEN (Nov 5),,2025-11-05,MIA,DEN
KXNBAGAME-25NOV05NOPDAL,KXNBAGAME,New Orleans vs Dallas,NOP at DAL (Nov 5),,2025-11-05,NOP,DAL
KXNBAGAME-25NOV05HOUMEM,KXNBAGAME,Houston vs Memphis,HOU at MEM (Nov 5),,2025-11-05,HOU,MEM
KXNBAGAME-25NOV05WASBOS,KXNBAGAME,Washington vs Boston,WAS at BOS (Nov 5),,2025-11-05,WAS,BOS
KXNBAGAME-25NOV05MINNYK,KXNBAGAME,Minnesota vs New York K,MIN at NYK (Nov 5),,2025-11-05,MIN,NYK
KXNBAGAME-25NOV05UTADET,KXNBAGAME,Utah vs Detroit,UTA at DET (Nov 5),,2025-11-05,UTA,DET
KXNBAGAME-25NOV05PHICLE,KXNBAGAME,Philadelphia vs Cleveland,PHI at CLE (Nov 5),,2025-11-05,PHI,CLE
KXNBAGAME-25NOV05BKNIND,KXNBAGAME,Brooklyn vs Indiana,BKN at IND (Nov 5),,2025-11-05,BKN,IND
KXNBAGAME-25NOV04OKCLAC,KXNBAGAME,Oklahoma City vs Los Angeles C,OKC at LAC (Nov 4),,2025-11-04,OKC,LAC
KXNBAGAME-25NOV04PHXGSW,KXNBAGAME,Phoenix vs Golden State,PHX at GSW (Nov 4),,2025-11-04,PHX,GSW
KXNBAGAME-25NOV04PHICHI,KXNBAGAME,Philadelphia vs Chicago,PHI at CHI (Nov 4),,2025-11-04,PHI,CHI
KXNBAGAME-25NOV04ORLATL,KXNBAGAME,Orlando vs Atlanta,ORL at ATL (Nov 4),,2025-11-04,ORL,ATL
KXNBAGAME-25NOV04CHANOP,KXNBAGAME,Charlotte vs New Orleans,CHA at NOP (Nov 4),,2025-11-04,CHA,NOP
KXNBAGAME-25NOV04MILTOR,KXNBAGAME,Milwaukee vs Toronto,MIL at TOR (Nov 4),,2025-11-04,MIL,TOR
KXNBAGAME-25NOV03MIALAC,KXNBAGAME,Miami vs LA,MIA at LAC (Nov 3),,2025-11-03,MIA,LAC
KXNBAGAME-25NOV03LALPOR,KXNBAGAME,Los Angeles vs Portland,LAL at POR (Nov 3),,2025-11-03,LAL,POR
KXNBAGAME-25NOV03SACDEN,KXNBAGAME,Sacramento vs Denver,SAC at DEN (Nov 3),,2025-11-03,SAC,DEN
KXNBAGAME-25NOV03DETMEM,KXNBAGAME,Detroit vs Memphis,DET at MEM (Nov 3),,2025-11-03,DET,MEM
KXNBAGAME-25NOV03DALHOU,KXNBAGAME,Dallas vs Houston,DAL at HOU (Nov 3),,2025-11-03,DAL,HOU
KXNBAGAME-25NOV03WASNYK,KXNBAGAME,Washington vs New York K,WAS at NYK (Nov 3),,2025-11-03,WAS,NYK
KXNBAGAME-25NOV03UTABOS,KXNBAGAME,Utah vs Boston,UTA at BOS (Nov 3),,2025-11-03,UTA,BOS
KXNBAGAME-25NOV03MINBKN,KXNBAGAME,Minnesota vs Brooklyn,MIN at BKN (Nov 3),,2025-11-03,MIN,BKN
KXNBAGAME-25NOV03MILIND,KXNBAGAME,Milwaukee vs Indiana,MIL at IND (Nov 3),,2025-11-03,MIL,IND
KXNBAGAME-25NOV02MIALAL,KXNBAGAME,Miami vs Los Angeles,MIA at LAL (Nov 2),,2025-11-02,MIA,LAL
KXNBAGAME-25NOV02SASPHX,KXNBAGAME,San Antonio vs Phoenix,SAS at PHX (Nov 2),,2025-11-02,SAS,PHX
KXNBAGAME-25NOV02CHINYK,KXNBAGAME,Chicago vs New York K,CHI at NYK (Nov 2),,2025-11-02,CHI,NYK
KXNBAGAME-25NOV02UTACHA,KXNBAGAME,Utah vs Charlotte,UTA at CHA (Nov 2),,2025-11-02,UTA,CHA
KXNBAGAME-25NOV02PHIBKN,KXNBAGAME,Philadelphia vs Brooklyn,PHI at BKN (Nov 2),,2025-11-02,PHI,BKN
KXNBAGAME-25NOV02MEMTOR,KXNBAGAME,Memphis vs Toronto,MEM at TOR (Nov 2),,2025-11-02,MEM,TOR
KXNBAGAME-25NOV02ATLCLE,KXNBAGAME,Atlanta vs Cleveland,ATL at CLE (Nov 2),,2025-11-02,ATL,CLE
KXNBAGAME-25NOV02NOPOKC,KXNBAGAME,New Orleans vs Oklahoma City,NOP at OKC (Nov 2),,2025-11-02,NOP,OKC
KXNBAGAME-25NOV01DALDET,KXNBAGAME,Dallas vs Detroit,DAL at DET (Nov 1),,2025-11-01,DAL,DET
KXNBAGAME-25NOV01HOUBOS,KXNBAGAME,Houston vs Boston,HOU at BOS (Nov 1),,2025-11-01,HOU,BOS
KXNBAGAME-25NOV01ORLWAS,KXNBAGAME,Orlando vs Washington,ORL at WAS (Nov 1),,2025-11-01,ORL,WAS
KXNBAGAME-25NOV01GSWIND,KXNBAGAME,Golden State vs Indiana,GSW at IND (Nov 1),,2025-11-01,GSW,IND
KXNBAGAME-25NOV01MINCHA,KXNBAGAME,Minnesota vs Charlotte,MIN at CHA (Nov 1),,2025-11-01,MIN,CHA
KXNBAGAME-25NOV01SACMIL,KXNBAGAME,Sacramento vs Milwaukee,SAC at MIL (Nov 1),,2025-11-01,SAC,MIL
KXNBAGAME-25OCT31NOPLAC,KXNBAGAME,New Orleans vs Los Angeles C,NOP at LAC (Oct 31),,2025-10-31,NOP,LAC
KXNBAGAME-25OCT31UTAPHX,KXNBAGAME,Utah vs Phoenix,UTA at PHX (Oct 31),,2025-10-31,UTA,PHX
KXNBAGAME-25OCT31DENPOR,KXNBAGAME,Denver vs Portland,DEN at POR (Oct 31),,2025-10-31,DEN,POR
KXNBAGAME-25OCT31LALMEM,KXNBAGAME,Los Angeles L vs Memphis,LAL at MEM (Oct 31),,2025-10-31,LAL,MEM
KXNBAGAME-25OCT31NYKCHI,KXNBAGAME,New York vs Chicago,NYK at CHI (Oct 31),,2025-10-31,NYK,CHI
KXNBAGAME-25OCT31TORCLE,KXNBAGAME,Toronto vs Cleveland,TOR at CLE (Oct 31),,2025-10-31,TOR,CLE
KXNBAGAME-25OCT31BOSPHI,KXNBAGAME,Boston vs Philadelphia,BOS at PHI (Oct 31),,2025-10-31,BOS,PHI
KXNBAGAME-25OCT31ATLIND,KXNBAGAME,Atlanta vs Indiana,ATL at IND (Oct 31),,2025-10-31,ATL,IND
KXNBAGAME-25OCT30MIASAS,KXNBAGAME,Miami vs San Antonio,MIA at SAS (Oct 30),,2025-10-30,MIA,SAS
KXNBAGAME-25OCT30WASOKC,KXNBAGAME,Washington vs Oklahoma City,WAS at OKC (Oct 30),,2025-10-30,WAS,OKC
KXNBAGAME-25OCT30GSWMIL,KXNBAGAME,Golden State vs Milwaukee,GSW at MIL (Oct 30),,2025-10-30,GSW,MIL
KXNBAGAME-25OCT30ORLCHA,KXNBAGAME,Orlando vs Charlotte,ORL at CHA (Oct 30),,2025-10-30,ORL,CHA
KXNBAGAME-25OCT29MEMPHX,KXNBAGAME,Memphis vs Phoenix,MEM at PHX (Oct 29),,2025-10-29,MEM,PHX
KXNBAGAME-25OCT29LALMIN,KXNBAGAME,Los Angeles L vs Minnesota,LAL at MIN (Oct 29),,2025-10-29,LAL,MIN
KXNBAGAME-25OCT29PORUTA,KXNBAGAME,Portland vs Utah,POR at UTA (Oct 29),,2025-10-29,POR,UTA
KXNBAGAME-25OCT29NOPDEN,KXNBAGAME,New Orleans vs Denver,NOP at DEN (Oct 29),,2025-10-29,NOP,DEN
KXNBAGAME-25OCT29INDDAL,KXNBAGAME,Indiana vs Dallas,IND at DAL (Oct 29),,2025-10-29,IND,DAL
KXNBAGAME-25OCT29SACCHI,KXNBAGAME,Sacramento vs Chicago,SAC at CHI (Oct 29),,2025-10-29,SAC,CHI
KXNBAGAME-25OCT29ATLBKN,KXNBAGAME,Atlanta vs Brooklyn,ATL at BKN (Oct 29),,2025-10-29,ATL,BKN
KXNBAGAME-25OCT29ORLDET,KXNBAGAME,Orlando vs Detroit,ORL at DET (Oct 29),,2025-10-29,ORL,DET
KXNBAGAME-25OCT29CLEBOS,KXNBAGAME,Cleveland vs Boston,CLE at BOS (Oct 29),,2025-10-29,CLE,BOS
KXNBAGAME-25OCT29HOUTOR,KXNBAGAME,Houston vs Toronto,HOU at TOR (Oct 29),,2025-10-29,HOU,TOR
KXNBAGAME-25OCT28LACGSW,KXNBAGAME,Los Angeles C vs Golden State,LAC at GSW (Oct 28),,2025-10-28,LAC,GSW
KXNBAGAME-25OCT28SACOKC,KXNBAGAME,Sacramento vs Oklahoma City,SAC at OKC (Oct 28),,2025-10-28,SAC,OKC
KXNBAGAME-25OCT28NYKMIL,KXNBAGAME,New York vs Milwaukee,NYK at MIL (Oct 28),,2025-10-28,NYK,MIL
KXNBAGAME-25OCT28CHAMIA,KXNBAGAME,Charlotte vs Miami,CHA at MIA (Oct 28),,2025-10-28,CHA,MIA
KXNBAGAME-25OCT28PHIWAS,KXNBAGAME,Philadelphia vs Washington,PHI at WAS (Oct 28),,2025-10-28,PHI,WAS
KXNBAGAME-25OCT27PORLAL,KXNBAGAME,Portland vs Los Angeles L,POR at LAL (Oct 27),,2025-10-27,POR,LAL
KXNBAGAME-25OCT27MEMGSW,KXNBAGAME,Memphis vs Golden State,MEM at GSW (Oct 27),,2025-10-27,MEM,GSW
KXNBAGAME-25OCT27DENMIN,KXNBAGAME,Denver vs Minnesota,DEN at MIN (Oct 27),,2025-10-27,DEN,MIN
KXNBAGAME-25OCT27PHXUTA,KXNBAGAME,Phoenix vs Utah,PHX at UTA (Oct 27),,2025-10-27,PHX,UTA
KXNBAGAME-25OCT27OKCDAL,KXNBAGAME,Oklahoma City vs Dallas,OKC at DAL (Oct 27),,2025-10-27,OKC,DAL
KXNBAGAME-25OCT27TORSAS,KXNBAGAME,Toronto vs San Antonio,TOR at SAS (Oct 27),,2025-10-27,TOR,SAS
KXNBAGAME-25OCT27BOSNOP,KXNBAGAME,Boston vs New Orleans,BOS at NOP (Oct 27),,2025-10-27,BOS,NOP
KXNBAGAME-25OCT27BKNHOU,KXNBAGAME,Brooklyn vs Houston,BKN at HOU (Oct 27),,2025-10-27,BKN,HOU
KXNBAGAME-25OCT27ATLCHI,KXNBAGAME,Atlanta vs Chicago,ATL at CHI (Oct 27),,2025-10-27,ATL,CHI
KXNBAGAME-25OCT27ORLPHI,KXNBAGAME,Orlando vs Philadelphia,ORL at PHI (Oct 27),,2025-10-27,ORL,PHI
KXNBAGAME-25OCT27CLEDET,KXNBAGAME,Cleveland vs Detroit,CLE at DET (Oct 27),,2025-10-27,CLE,DET
KXNBAGAME-25OCT26PORLAC,KXNBAGAME,Portland vs Los Angeles C,POR at LAC (Oct 26),,2025-10-26,POR,LAC
KXNBAGAME-25OCT26LALSAC,KXNBAGAME,Los Angeles L vs Sacramento,LAL at SAC (Oct 26),,2025-10-26,LAL,SAC
KXNBAGAME-25OCT26TORDAL,KXNBAGAME,Toronto vs Dallas,TOR at DAL (Oct 26),,2025-10-26,TOR,DAL
KXNBAGAME-25OCT26INDMIN,KXNBAGAME,Indiana vs Minnesota,IND at MIN (Oct 26),,2025-10-26,IND,MIN
KXNBAGAME-25OCT26NYKMIA,KXNBAGAME,New York vs Miami,NYK at MIA (Oct 26),,2025-10-26,NYK,MIA
KXNBAGAME-25OCT26MILCLE,KXNBAGAME,Milwaukee vs Cleveland,MIL at CLE (Oct 26),,2025-10-26,MIL,CLE
KXNBAGAME-25OCT26CHAWAS,KXNBAGAME,Charlotte vs Washington,CHA at WAS (Oct 26),,2025-10-26,CHA,WAS
KXNBAGAME-25OCT26BOSDET,KXNBAGAME,Boston vs Detroit,BOS at DET (Oct 26),,2025-10-26,BOS,DET
KXNBAGAME-25OCT26BKNSAS,KXNBAGAME,Brooklyn vs San Antonio,BKN at SAS (Oct 26),,2025-10-26,BKN,SAS
KXNBAGAME-25OCT25PHXDEN,KXNBAGAME,Phoenix vs Denver,PHX at DEN (Oct 25),,2025-10-25,PHX,DEN
KXNBAGAME-25OCT25INDMEM,KXNBAGAME,Indiana vs Memphis,IND at MEM (Oct 25),,2025-10-25,IND,MEM
KXNBAGAME-25OCT25OKCATL,KXNBAGAME,Oklahoma City vs Atlanta,OKC at ATL (Oct 25),,2025-10-25,OKC,ATL
KXNBAGAME-25OCT25CHAPHI,KXNBAGAME,Charlotte vs Philadelphia,CHA at PHI (Oct 25),,2025-10-25,CHA,PHI
KXNBAGAME-25OCT25CHIORL,KXNBAGAME,Chicago vs Orlando,CHI at ORL (Oct 25),,2025-10-25,CHI,ORL
KXNBAGAME-25OCT24PHXLAC,KXNBAGAME,Phoenix vs Los Angeles C,PHX at LAC (Oct 24),,2025-10-24,PHX,LAC
KXNBAGAME-25OCT24UTASAC,KXNBAGAME,Utah vs Sacramento,UTA at SAC (Oct 24),,2025-10-24,UTA,SAC
KXNBAGAME-25OCT24MINLAL,KXNBAGAME,Minnesota vs Los Angeles L,MIN at LAL (Oct 24),,2025-10-24,MIN,LAL
KXNBAGAME-25OCT24GSWPOR,KXNBAGAME,Golden State vs Portland,GSW at POR (Oct 24),,2025-10-24,GSW,POR
KXNBAGAME-25OCT24WASDAL,KXNBAGAME,Washington vs Dallas,WAS at DAL (Oct 24),,2025-10-24,WAS,DAL
KXNBAGAME-25OCT24SASNOP,KXNBAGAME,San Antonio vs New Orleans,SAS at NOP (Oct 24),,2025-10-24,SAS,NOP
KXNBAGAME-25OCT24MIAMEM,KXNBAGAME,Miami vs Memphis,MIA at MEM (Oct 24),,2025-10-24,MIA,MEM
KXNBAGAME-25OCT24DETHOU,KXNBAGAME,Detroit vs Houston,DET at HOU (Oct 24),,2025-10-24,DET,HOU
KXNBAGAME-25OCT24CLEBKN,KXNBAGAME,Cleveland vs Brooklyn,CLE at BKN (Oct 24),,2025-10-24,CLE,BKN
KXNBAGAME-25OCT24BOSNYK,KXNBAGAME,Boston vs New York,BOS at NYK (Oct 24),,2025-10-24,BOS,NYK
KXNBAGAME-25OCT24ATLORL,KXNBAGAME,Atlanta vs Orlando,ATL at ORL (Oct 24),,2025-10-24,ATL,ORL
KXNBAGAME-25OCT24MILTOR,KXNBAGAME,Milwaukee vs Toronto,MIL at TOR (Oct 24),,2025-10-24,MIL,TOR
KXNBAGAME-25OCT23DENGSW,KXNBAGAME,Denver vs Golden State,DEN at GSW (Oct 23),,2025-10-23,DEN,GSW
KXNBAGAME-25OCT23OKCIND,KXNBAGAME,Oklahoma City vs Indiana,OKC at IND (Oct 23),,2025-10-23,OKC,IND
KXNBAGAME-25OCT22SACPHX,KXNBAGAME,Sacramento vs Phoenix,SAC at PHX (Oct 22),,2025-10-22,SAC,PHX
KXNBAGAME-25OCT22MINPOR,KXNBAGAME,Minnesota vs Portland,MIN at POR (Oct 22),,2025-10-22,MIN,POR
KXNBAGAME-25OCT22SASDAL,KXNBAGAME,San Antonio vs Dallas,SAS at DAL (Oct 22),,2025-10-22,SAS,DAL
KXNBAGAME-25OCT22LACUTA,KXNBAGAME,Los Angeles C vs Utah,LAC at UTA (Oct 22),,2025-10-22,LAC,UTA
KXNBAGAME-25OCT22WASMIL,KXNBAGAME,Washington vs Milwaukee,WAS at MIL (Oct 22),,2025-10-22,WAS,MIL
KXNBAGAME-25OCT22NOPMEM,KXNBAGAME,New Orleans vs Memphis,NOP at MEM (Oct 22),,2025-10-22,NOP,MEM
KXNBAGAME-25OCT22DETCHI,KXNBAGAME,Detroit vs Chicago,DET at CHI (Oct 22),,2025-10-22,DET,CHI
KXNBAGAME-25OCT22TORATL,KXNBAGAME,Toronto vs Atlanta,TOR at ATL (Oct 22),,2025-10-22,TOR,ATL
KXNBAGAME-25OCT22PHIBOS,KXNBAGAME,Philadelphia vs Boston,PHI at BOS (Oct 22),,2025-10-22,PHI,BOS
KXNBAGAME-25OCT22MIAORL,KXNBAGAME,Miami vs Orlando,MIA at ORL (Oct 22),,2025-10-22,MIA,ORL
KXNBAGAME-25OCT22CLENYK,KXNBAGAME,Cleveland vs New York,CLE at NYK (Oct 22),,2025-10-22,CLE,NYK
KXNBAGAME-25OCT22BKNCHA,KXNBAGAME,Brooklyn vs Charlotte,BKN at CHA (Oct 22),,2025-10-22,BKN,CHA
KXNBAGAME-25OCT21GSWLAL,KXNBAGAME,Golden State vs Los Angeles L,GSW at LAL (Oct 21),,2025-10-21,GSW,LAL
KXNBAGAME-25OCT21HOUOKC,KXNBAGAME,Houston vs Oklahoma City,HOU at OKC (Oct 21),,2025-10-21,HOU,OKC
KXNBAGAME-25OCT17SACLAL,KXNBAGAME,Sacramento vs Los Angeles L,SAC at LAL (Oct 17),,2025-10-17,SAC,LAL
KXNBAGAME-25OCT17LACGSW,KXNBAGAME,Los Angeles C vs Golden State,LAC at GSW (Oct 17),,2025-10-17,LAC,GSW
KXNBAGAME-25OCT17MEMMIA,KXNBAGAME,Memphis vs Miami,MEM at MIA (Oct 17),,2025-10-17,MEM,MIA
KXNBAGAME-25OCT17INDSAS,KXNBAGAME,Indiana vs San Antonio,IND at SAS (Oct 17),,2025-10-17,IND,SAS
KXNBAGAME-25OCT17DENOKC,KXNBAGAME,Denver vs Oklahoma City,DEN at OKC (Oct 17),,2025-10-17,DEN,OKC
KXNBAGAME-25OCT17CHANYK,KXNBAGAME,Charlotte vs New York,CHA at NYK (Oct 17),,2025-10-17,CHA,NYK
KXNBAGAME-25OCT17MINPHI,KXNBAGAME,Minnesota vs Philadelphia,MIN at PHI (Oct 17),,2025-10-17,MIN,PHI
KXNBAGAME-25OCT17BKNTOR,KXNBAGAME,Brooklyn vs Toronto,BKN at TOR (Oct 17),,2025-10-17,BKN,TOR
KXNBAGAME-25OCT16PORUTA,KXNBAGAME,Portland vs Utah,POR at UTA (Oct 16),,2025-10-16,POR,UTA
KXNBAGAME-25OCT16MINCHI,KXNBAGAME,Minnesota vs Chicago,MIN at CHI (Oct 16),,2025-10-16,MIN,CHI
KXNBAGAME-25OCT16HOUATL,KXNBAGAME,Houston vs Atlanta,HOU at ATL (Oct 16),,2025-10-16,HOU,ATL
KXNBAGAME-25OCT16WASDET,KXNBAGAME,Washington vs Detroit,WAS at DET (Oct 16),,2025-10-16,WAS,DET
KXNBAGAME-25OCT16NOPORL,KXNBAGAME,New Orleans vs Orlando,NOP at ORL (Oct 16),,2025-10-16,NOP,ORL
KXNBAGAME-25OCT15DALLAL,KXNBAGAME,Dallas vs Los Angeles L,DAL at LAL (Oct 15),,2025-10-15,DAL,LAL
KXNBAGAME-25OCT15LACSAC,KXNBAGAME,LA vs Sacramento,LAC at SAC (Oct 15),,2025-10-15,LAC,SAC
KXNBAGAME-25OCT15TORBOS,KXNBAGAME,Toronto vs Boston,TOR at BOS (Oct 15),,2025-10-15,TOR,BOS
KXNBAGAME-25OCT15MEMCHA,KXNBAGAME,Memphis vs Charlotte,MEM at CHA (Oct 15),,2025-10-15,MEM,CHA
KXNBAGAME-25OCT14LALPHX,KXNBAGAME,Los Angeles L vs Phoenix,LAL at PHX (Oct 14),,2025-10-14,LAL,PHX
KXNBAGAME-25OCT14GSWPOR,KXNBAGAME,Golden State vs Portland,GSW at POR (Oct 14),,2025-10-14,GSW,POR
KXNBAGAME-25OCT14CHIDEN,KXNBAGAME,Chicago vs Denver,CHI at DEN (Oct 14),,2025-10-14,CHI,DEN
KXNBAGAME-25OCT14OKCMIL,KXNBAGAME,Oklahoma City vs Milwaukee,OKC at MIL (Oct 14),,2025-10-14,OKC,MIL
KXNBAGAME-25OCT14HOUNOP,KXNBAGAME,Houston vs New Orleans,HOU at NOP (Oct 14),,2025-10-14,HOU,NOP
KXNBAGAME-25OCT14DETCLE,KXNBAGAME,Detroit vs Cleveland,DET at CLE (Oct 14),,2025-10-14,DET,CLE
KXNBAGAME-25OCT13DALUTA,KXNBAGAME,Dallas vs Utah,DAL at UTA (Oct 13),,2025-10-13,DAL,UTA
KXNBAGAME-25OCT13GUAMIN,KXNBAGAME,Guangzhou vs Minnesota,GUA at MIN (Oct 13),,2025-10-13,GUA,MIN
KXNBAGAME-25OCT13WASNYK,KXNBAGAME,Washington vs New York,WAS at NYK (Oct 13),,2025-10-13,WAS,NYK
KXNBAGAME-25OCT13SASIND,KXNBAGAME,San Antonio vs Indiana,SAS at IND (Oct 13),,2025-10-13,SAS,IND
KXNBAGAME-25OCT13MIAATL,KXNBAGAME,Miami vs Atlanta,MIA at ATL (Oct 13),,2025-10-13,MIA,ATL
KXNBAGAME-25OCT12GSWLAL,KXNBAGAME,Golden State vs Los Angeles L,GSW at LAL (Oct 12),,2025-10-12,GSW,LAL
KXNBAGAME-25OCT12DENLAC,KXNBAGAME,Denver vs LA,DEN at LAC (Oct 12),,2025-10-12,DEN,LAC
KXNBAGAME-25OCT12MILCHI,KXNBAGAME,Milwaukee vs Chicago,MIL at CHI (Oct 12),,2025-10-12,MIL,CHI
KXNBAGAME-25OCT12CLEBOS,KXNBAGAME,Cleveland vs Boston,CLE at BOS (Oct 12),,2025-10-12,CLE,BOS
KXNBAGAME-25OCT12MIAORL,KXNBAGAME,Miami vs Orlando,MIA at ORL (Oct 12),,2025-10-12,MIA,ORL
